
Campaign	Ad Group	Final URL	Headline 1	Headline 1 Position	Headline 2	Headline 2 Position	Headline 3	Headline 3 Position	Headline 4	Headline 5	Headline 6	Headline 7	Headline 8	Headline 9	Headline 10	Description 1	Description 2	Description 3	Description 4	Path 1	Path 2
Search-1	AG_Implant_SM	https://www.dentcraft.ro/preturi#calculator	Implant Dentar Satu Mare	1	DENTCRAFT — De la 2500 lei	2	Calculator Pret in 60 sec	3	Garantie Inclusa · Plan Scris	Scanner 3D · Anestezie Blanda	All-on-4 si All-on-6 Acum	1500+ Pacienti Tratati	Consultatie Gratuita	Dr. Petric · 10+ Ani Exp.	Implant Premium Satu Mare	Calculator pret online: minim si maxim in 60 sec. Plan scris, garantie.	Dr. Petric: 10+ ani, 1500+ pacienti. Scanner 3D, anestezie blanda.	Implant dentar de la 2500 lei. Consultatie gratuita, plan personalizat.	Programeaza: 0741 199 977 sau online. Str. Delavrancea 3, Satu Mare.	implant	satu-mare
Search-1	AG_Estetica_SM	https://www.dentcraft.ro/galerie	Fatete Ceramice Satu Mare	1	Hollywood Smile · DENTCRAFT	2	Vezi Cazuri Reale pe Site	3	Albire LED Profesionala	Materiale Premium e.max	Calculator Pret · 60 sec	Dr. Petric · Estetica Premium	Consultatie Estetica Gratis	Plan Personalizat · Garantie	Programeaza — RO · EN · HU	Fatete ceramice personalizate la DENTCRAFT. Zambet natural, plan scris.	Hollywood Smile cu Dr. Petric. 10+ ani experienta. Consultatie gratuita.	Albire LED + fatete e.max. Comunicare clara. Suna: 0741 199 977.	Estetica dentara de top. Scanner 3D, planificare digitala in 60 sec.	fatete	satu-mare
Search-1	AG_Ortodontie_SM	https://www.dentcraft.ro/servicii/ortodontie	Aparat Dentar Satu Mare	1	Copii si Adulti · Invisalign	2	DENTCRAFT — Plan Personalizat	3	Metalic Ceramic Invisalign	Consultatie Ortodontica Gratis	Calculator Pret in 60 sec	Aparat Copii · Cu Blandete	Dr. Petric · 10+ Ani Exp.	Scanner 3D · Plan Digital	Tratament Complet · Garantie	Aparate dentare pentru copii si adulti. Metalice, ceramice, Invisalign.	Ortodontie cu Dr. Petric — blanda pentru copii, eficienta pentru adulti.	Calculator pret online — vezi minim si maxim in 60 sec. Scanner 3D.	Programeaza: 0741 199 977. Plan scris inainte, ambient relaxant.	ortodontie	satu-mare
Search-1	AG_General_SM	https://www.dentcraft.ro/	Stomatolog Satu Mare DENTCRAFT	1	Calculator Pret Online Gratis	2	Plan Scris Inainte · Garantie	3	Implant Ortodontie Estetica	Consultatie Gratuita Aici	Dr. Petric · 1500+ Pacienti	Programeaza in 60 Secunde	Anestezie Blanda · Fara Durere	Cabinet Modern Satu Mare	RO · EN · HU — Limba Ta	Clinica DENTCRAFT Satu Mare. Calculator pret online, plan scris, garantie.	Implant, ortodontie, fatete, albire. Dr. Petric, 10+ ani experienta.	Vezi minim si maxim in 60 sec. Fara telefon, fara asteptare.	Programeaza: 0741 199 977 sau online. Str. Delavrancea 3, Satu Mare.	stomatolog	satu-mare
Search-1	AG_Brand_SM	https://www.dentcraft.ro/	DENTCRAFT — Site Oficial	1	Stomatologie Satu Mare	2	Dr. Petric · Programari Online	3	Calculator Pret · Plan Scris	10+ Ani · 1500+ Pacienti	Consultatie Gratuita Aici	Vezi Recenzii Google Reale	Programeaza in 60 Secunde	Anestezie Blanda · Fara Durere	RO · EN · HU — Limba Ta	Site-ul oficial DENTCRAFT Satu Mare. Programari online 24/7, plan scris.	Dr. Petric si echipa. 10+ ani, 1500+ pacienti, recenzii reale Google.	Toate serviciile: implant, ortodontie, fatete, albire, pedodontie.	Contact: 0741 199 977 sau programare online. Str. Delavrancea 3.	dentcraft	satu-mare
